{"artifacts":[{"attribution":"https://huggingface.co/sahilchachra/ovisocr2-int4-mlx","decode_limits":{"max_input_tokens":32768,"max_output_tokens":4096},"files":[{"path":"README.md","sha256":"889474c887e205cb31e67e6ad8905ca8936449363f635ec50fc080cb5bac7fc1","size":5663},{"path":"chat_template.jinja","sha256":"273d8e0e683b885071fb17e08d71e5f2a5ddfb5309756181681de4f5a1822d80","size":7755},{"path":"config.json","sha256":"ba7770da23eae5ebd6827571f086e331956b33f4442a9e876fb4aa10969a6772","size":3112},{"path":"model.safetensors","sha256":"f50f71fdd9628a1a33825039e734f036d9b5365dea2f7c46ab984dbae0c441a1","size":625228929},{"path":"model.safetensors.index.json","sha256":"537647c932f13ff73ffac6a96ff846182e9ab67f28e91a29111af482d81e2eda","size":71473},{"path":"preprocessor_config.json","sha256":"27225450ac9c6529872ee1924fcb0962ff5634834f817040f444118116f4e516","size":390},{"path":"processor_config.json","sha256":"45fc17c8dd2474af6b493b52483c26c0584b0082d368c480f9fa611e73070040","size":991},{"path":"tokenizer.json","sha256":"06b9509352d2af50381ab2247e083b80d32d5c0aba91c272ca9ff729b6a0e523","size":19989325},{"path":"tokenizer_config.json","sha256":"792fa3f0cb88b111e54ef3134c873531008c4df471d108da17903426e308aa7b","size":1165},{"path":"video_preprocessor_config.json","sha256":"7768af27c1fafa9cc9011c1dc20067e03f8915e03b63504550e11d5066986d13","size":385},{"path":"vocab.json","sha256":"ce99b4cb2983d118806ce0a8b777a35b093e2000a503ebde25853284c9dfa003","size":6722759}],"license":"apache-2.0","quantization":"int4","repository":"sahilchachra/ovisocr2-int4-mlx","revision":"1e9cea98871c19b2349a5d2df36fb6c4c38a1237","role":"ocr"},{"attribution":"https://huggingface.co/numind/NuExtract3-mlx-4bits; license-source=https://huggingface.co/numind/NuExtract3/resolve/2e9fca82ee641e6bb6e1f5d905241e994be27a07/LICENSE; license-sha256=50cbab8a892c5f2993b8c7351a99182507472def3b1374558308605d99b86b32","decode_limits":{"max_input_tokens":32768,"max_output_tokens":8192},"files":[{"path":"README.md","sha256":"ab9c0a077a638ebe7d13f49a7a17c89348aa15f86bbad3b347ef22d1ed4ccf4d","size":438},{"path":"chat_template.jinja","sha256":"31e44d28615d268efdc3dcf59cb59bd2d51714d517455fbad97518d351b84119","size":6752},{"path":"config.json","sha256":"f2c0acf465103d4b2215376c1a48c72af9888e00b006b9220f3ea629428a2daa","size":3595},{"path":"generation_config.json","sha256":"eda6aa8b0fbde9fbe38c044c6ba3c2890d4a9aad3cdd348da5ffe0ff0f91df09","size":115},{"path":"model.safetensors","sha256":"10a9eba209684388f37e2971a58f8fd0cb4edf866f337c0413cf37561cc9208c","size":3034299183},{"path":"model.safetensors.index.json","sha256":"840634e215ba74eb1ff53c03660b82443d249845884910e87b1a99a258225951","size":101944},{"path":"processor_config.json","sha256":"0b6914a28baac03bd598699d7223d2df2403a904baded62b7ed1fcb5c3b53205","size":991},{"path":"tokenizer.json","sha256":"87a7830d63fcf43bf241c3c5242e96e62dd3fdc29224ca26fed8ea333db72de4","size":19989343},{"path":"tokenizer_config.json","sha256":"c908cd42c5e6eac721445fb70841e45845a6a269c6ef2c595e97a578a9724671","size":1168}],"license":"apache-2.0","quantization":"4bit","repository":"numind/NuExtract3-mlx-4bits","revision":"29c38269f94054282bf9ea97a20dfc6bb8bbefea","role":"extraction"},{"attribution":"https://huggingface.co/mlx-community/Qwen3.5-9B-MLX-4bit","decode_limits":{"max_input_tokens":32768,"max_output_tokens":4096},"files":[{"path":"README.md","sha256":"7cbe4c3e07a5465d52d60c94c71f8d578113550eb767d331553f9ca19538ce56","size":1954},{"path":"chat_template.jinja","sha256":"a4aee8afcf2e0711942cf848899be66016f8d14a889ff9ede07bca099c28f715","size":7756},{"path":"config.json","sha256":"a96942cb6a8a1d3f1d17514d81a1925d04362a6a3233b389d13012211baaa9f8","size":3331},{"path":"model-00001-of-00002.safetensors","sha256":"a68b87558c6ef43f74c2bd63ce7e9092ceddc3101f3def0030774bae5f42aadd","size":5349771222},{"path":"model-00002-of-00002.safetensors","sha256":"b0a770bf8469c7f3f18756a0e0283f1c1174344a83e059a4e483f6af4907352d","size":600449850},{"path":"model.safetensors.index.json","sha256":"dd023913fb87cfdae27fb11dcf695117c925833796ccac3c64117d6652d8ff1e","size":123592},{"path":"preprocessor_config.json","sha256":"27225450ac9c6529872ee1924fcb0962ff5634834f817040f444118116f4e516","size":390},{"path":"processor_config.json","sha256":"14932921ca485d458a04dafd8069fbb0a4505622a48208d19ed247115801385b","size":1300},{"path":"tokenizer.json","sha256":"87a7830d63fcf43bf241c3c5242e96e62dd3fdc29224ca26fed8ea333db72de4","size":19989343},{"path":"tokenizer_config.json","sha256":"e98f1901ac6f0adff67b1d540bfa0c36ac1a0cf59eb72ed78146ef89aafa1182","size":1139},{"path":"video_preprocessor_config.json","sha256":"7768af27c1fafa9cc9011c1dc20067e03f8915e03b63504550e11d5066986d13","size":385},{"path":"vocab.json","sha256":"ce99b4cb2983d118806ce0a8b777a35b093e2000a503ebde25853284c9dfa003","size":6722759}],"license":"apache-2.0","quantization":"4bit","repository":"mlx-community/Qwen3.5-9B-MLX-4bit","revision":"938d8919941c6e7efd3c7150eff7fe9d12afa631","role":"summary"}],"pack_revision":"apple-m4-16gb-v1","platform":"apple_silicon","runtime":{"name":"mlx-vlm","version":"0.5.0"},"schema_version":1,"validation_suite_version":"local-ai-fixtures-v1"}
